{
  "schema_version": "1.0.0",
  "artifact_type": "source_metadata",
  "artifact_id": "source-metadata-2a6d72e9e5fa",
  "generated_at": "2026-07-17T09:22:17.500029+00:00",
  "source": {
    "relative_path": "input/edc/ae09jun2025.sas7bdat",
    "format": "sas7bdat",
    "sha256": "2a6d72e9e5fa4bb8e3cc14b0c412fce3c37e519f3ab9105cdcff33ba031e8749",
    "size_bytes": 19667968
  },
  "parser": {
    "name": "clinical-workflow-edc-importer",
    "version": "1.0.0",
    "python_version": "3.14.4",
    "library_versions": {
      "pandas": "3.0.3",
      "pyreadstat": "1.3.5"
    }
  },
  "dataset": {
    "row_count": 1066,
    "column_count": 73,
    "file_label": null,
    "file_encoding": "UTF-8",
    "file_format": "sas7bdat",
    "table_name": "AE09JUN2025"
  },
  "metadata_availability": {
    "column_labels": {
      "status": "available",
      "available_count": 73,
      "total_count": 73,
      "reason": null
    },
    "formats": {
      "status": "available",
      "available_count": 73,
      "total_count": 73,
      "reason": null
    },
    "informats": {
      "status": "unavailable",
      "available_count": 0,
      "total_count": 73,
      "reason": "pyreadstat does not expose SAS informats from this dataset"
    },
    "value_labels": {
      "status": "unavailable",
      "available_count": 0,
      "total_count": 73,
      "reason": "No resolvable value-label mapping is embedded or supplied by catalog"
    },
    "external_format_catalog": {
      "status": "not_supplied",
      "available_count": 0,
      "total_count": 1,
      "reason": "No external SAS format catalog was registered"
    }
  },
  "variables": [
    {
      "ordinal": 1,
      "name": "projectid",
      "logical_type": "double",
      "source_storage_type": "double",
      "storage_width": 8,
      "column_label": {
        "status": "available",
        "value": "projectid",
        "reason": null
      },
      "source_format": {
        "status": "available",
        "value": "10",
        "reason": null
      },
      "source_informat": {
        "status": "unavailable",
        "value": null,
        "reason": "pyreadstat does not expose SAS informats from this dataset"
      },
      "value_labels": {
        "status": "unavailable",
        "label_set": null,
        "mapping": {},
        "reason": "No resolvable value-label mapping is embedded or supplied by catalog"
      }
    },
    {
      "ordinal": 2,
      "name": "project",
      "logical_type": "string",
      "source_storage_type": "string",
      "storage_width": 765,
      "column_label": {
        "status": "available",
        "value": "project",
        "reason": null
      },
      "source_format": {
        "status": "available",
        "value": "$765",
        "reason": null
      },
      "source_informat": {
        "status": "unavailable",
        "value": null,
        "reason": "pyreadstat does not expose SAS informats from this dataset"
      },
      "value_labels": {
        "status": "unavailable",
        "label_set": null,
        "mapping": {},
        "reason": "No resolvable value-label mapping is embedded or supplied by catalog"
      }
    },
    {
      "ordinal": 3,
      "name": "studyid",
      "logical_type": "double",
      "source_storage_type": "double",
      "storage_width": 8,
      "column_label": {
        "status": "available",
        "value": "Internal id for the study",
        "reason": null
      },
      "source_format": {
        "status": "available",
        "value": "10",
        "reason": null
      },
      "source_informat": {
        "status": "unavailable",
        "value": null,
        "reason": "pyreadstat does not expose SAS informats from this dataset"
      },
      "value_labels": {
        "status": "unavailable",
        "label_set": null,
        "mapping": {},
        "reason": "No resolvable value-label mapping is embedded or supplied by catalog"
      }
    },
    {
      "ordinal": 4,
      "name": "environmentName",
      "logical_type": "string",
      "source_storage_type": "string",
      "storage_width": 60,
      "column_label": {
        "status": "available",
        "value": "Environment",
        "reason": null
      },
      "source_format": {
        "status": "available",
        "value": "$60",
        "reason": null
      },
      "source_informat": {
        "status": "unavailable",
        "value": null,
        "reason": "pyreadstat does not expose SAS informats from this dataset"
      },
      "value_labels": {
        "status": "unavailable",
        "label_set": null,
        "mapping": {},
        "reason": "No resolvable value-label mapping is embedded or supplied by catalog"
      }
    },
    {
      "ordinal": 5,
      "name": "subjectId",
      "logical_type": "double",
      "source_storage_type": "double",
      "storage_width": 8,
      "column_label": {
        "status": "available",
        "value": "Internal id for the subject",
        "reason": null
      },
      "source_format": {
        "status": "available",
        "value": "10",
        "reason": null
      },
      "source_informat": {
        "status": "unavailable",
        "value": null,
        "reason": "pyreadstat does not expose SAS informats from this dataset"
      },
      "value_labels": {
        "status": "unavailable",
        "label_set": null,
        "mapping": {},
        "reason": "No resolvable value-label mapping is embedded or supplied by catalog"
      }
    },
    {
      "ordinal": 6,
      "name": "StudySiteId",
      "logical_type": "double",
      "source_storage_type": "double",
      "storage_width": 8,
      "column_label": {
        "status": "available",
        "value": "Internal id for study site",
        "reason": null
      },
      "source_format": {
        "status": "available",
        "value": "10",
        "reason": null
      },
      "source_informat": {
        "status": "unavailable",
        "value": null,
        "reason": "pyreadstat does not expose SAS informats from this dataset"
      },
      "value_labels": {
        "status": "unavailable",
        "label_set": null,
        "mapping": {},
        "reason": "No resolvable value-label mapping is embedded or supplied by catalog"
      }
    },
    {
      "ordinal": 7,
      "name": "Subject",
      "logical_type": "string",
      "source_storage_type": "string",
      "storage_width": 150,
      "column_label": {
        "status": "available",
        "value": "Subject name or identifier",
        "reason": null
      },
      "source_format": {
        "status": "available",
        "value": "$150",
        "reason": null
      },
      "source_informat": {
        "status": "unavailable",
        "value": null,
        "reason": "pyreadstat does not expose SAS informats from this dataset"
      },
      "value_labels": {
        "status": "unavailable",
        "label_set": null,
        "mapping": {},
        "reason": "No resolvable value-label mapping is embedded or supplied by catalog"
      }
    },
    {
      "ordinal": 8,
      "name": "siteid",
      "logical_type": "double",
      "source_storage_type": "double",
      "storage_width": 8,
      "column_label": {
        "status": "available",
        "value": "Internal id for the site",
        "reason": null
      },
      "source_format": {
        "status": "available",
        "value": "10",
        "reason": null
      },
      "source_informat": {
        "status": "unavailable",
        "value": null,
        "reason": "pyreadstat does not expose SAS informats from this dataset"
      },
      "value_labels": {
        "status": "unavailable",
        "label_set": null,
        "mapping": {},
        "reason": "No resolvable value-label mapping is embedded or supplied by catalog"
      }
    },
    {
      "ordinal": 9,
      "name": "Site",
      "logical_type": "string",
      "source_storage_type": "string",
      "storage_width": 765,
      "column_label": {
        "status": "available",
        "value": "Site name",
        "reason": null
      },
      "source_format": {
        "status": "available",
        "value": "$765",
        "reason": null
      },
      "source_informat": {
        "status": "unavailable",
        "value": null,
        "reason": "pyreadstat does not expose SAS informats from this dataset"
      },
      "value_labels": {
        "status": "unavailable",
        "label_set": null,
        "mapping": {},
        "reason": "No resolvable value-label mapping is embedded or supplied by catalog"
      }
    },
    {
      "ordinal": 10,
      "name": "SiteNumber",
      "logical_type": "string",
      "source_storage_type": "string",
      "storage_width": 765,
      "column_label": {
        "status": "available",
        "value": "SiteNumber",
        "reason": null
      },
      "source_format": {
        "status": "available",
        "value": "$150",
        "reason": null
      },
      "source_informat": {
        "status": "unavailable",
        "value": null,
        "reason": "pyreadstat does not expose SAS informats from this dataset"
      },
      "value_labels": {
        "status": "unavailable",
        "label_set": null,
        "mapping": {},
        "reason": "No resolvable value-label mapping is embedded or supplied by catalog"
      }
    },
    {
      "ordinal": 11,
      "name": "SiteGroup",
      "logical_type": "string",
      "source_storage_type": "string",
      "storage_width": 120,
      "column_label": {
        "status": "available",
        "value": "SiteGroup",
        "reason": null
      },
      "source_format": {
        "status": "available",
        "value": "$120",
        "reason": null
      },
      "source_informat": {
        "status": "unavailable",
        "value": null,
        "reason": "pyreadstat does not expose SAS informats from this dataset"
      },
      "value_labels": {
        "status": "unavailable",
        "label_set": null,